{
  "$schema": "./schema.json",
  "route": "/en-US/index.html",
  "pageKey": "HotelHome",
  "capturedAt": "2026-08-18T04:57:48.644Z",
  "appBuild": "local-dev",
  "harvesterVersion": "1.0.0",
  "auth": {
    "roleKey": "unauthenticated"
  },
  "state": {
    "variantKey": "default"
  },
  "elements": [
    {
      "key": "loginButton",
      "role": "button",
      "accessibleName": "Login",
      "locator": "getByRole('button', { name: 'Login' })",
      "count": 1,
      "requiresScoping": false,
      "visible": true,
      "enabled": true,
      "firstSeenBuild": "local-dev"
    },
    {
      "key": "logoutButton",
      "role": "button",
      "accessibleName": "Logout",
      "locator": "getByRole('button', { name: 'Logout' })",
      "count": 1,
      "requiresScoping": false,
      "visible": false,
      "enabled": true,
      "firstSeenBuild": "local-dev"
    },
    {
      "key": "toggleNavigationButton",
      "role": "button",
      "accessibleName": "Toggle navigation",
      "locator": "getByRole('button', { name: 'Toggle navigation' })",
      "count": 1,
      "requiresScoping": false,
      "visible": false,
      "enabled": true,
      "firstSeenBuild": "local-dev"
    },
    {
      "key": "confirmationPageHeading",
      "role": "heading",
      "accessibleName": "Confirmation Page",
      "locator": "getByRole('heading', { name: 'Confirmation Page' })",
      "count": 1,
      "requiresScoping": false,
      "visible": true,
      "enabled": true,
      "firstSeenBuild": "local-dev"
    },
    {
      "key": "detailsHeading",
      "role": "heading",
      "accessibleName": "Details",
      "locator": "getByRole('heading', { name: 'Details' })",
      "count": 1,
      "requiresScoping": false,
      "visible": true,
      "enabled": true,
      "firstSeenBuild": "local-dev"
    },
    {
      "key": "hotelPlanisphereHeading",
      "role": "heading",
      "accessibleName": "Hotel Planisphere",
      "locator": "getByRole('heading', { name: 'Hotel Planisphere' })",
      "count": 1,
      "requiresScoping": false,
      "visible": true,
      "enabled": true,
      "firstSeenBuild": "local-dev"
    },
    {
      "key": "loginPageHeading",
      "role": "heading",
      "accessibleName": "Login Page",
      "locator": "getByRole('heading', { name: 'Login Page' })",
      "count": 1,
      "requiresScoping": false,
      "visible": true,
      "enabled": true,
      "firstSeenBuild": "local-dev"
    },
    {
      "key": "myPageHeading",
      "role": "heading",
      "accessibleName": "My Page",
      "locator": "getByRole('heading', { name: 'My Page' })",
      "count": 1,
      "requiresScoping": false,
      "visible": true,
      "enabled": true,
      "firstSeenBuild": "local-dev"
    },
    {
      "key": "noticeHeading",
      "role": "heading",
      "accessibleName": "Notice",
      "locator": "getByRole('heading', { name: 'Notice' })",
      "count": 1,
      "requiresScoping": false,
      "visible": true,
      "enabled": true,
      "firstSeenBuild": "local-dev"
    },
    {
      "key": "plansPageHeading",
      "role": "heading",
      "accessibleName": "Plans Page",
      "locator": "getByRole('heading', { name: 'Plans Page' })",
      "count": 1,
      "requiresScoping": false,
      "visible": true,
      "enabled": true,
      "firstSeenBuild": "local-dev"
    },
    {
      "key": "reservationPageHeading",
      "role": "heading",
      "accessibleName": "Reservation Page",
      "locator": "getByRole('heading', { name: 'Reservation Page' })",
      "count": 1,
      "requiresScoping": false,
      "visible": true,
      "enabled": true,
      "firstSeenBuild": "local-dev"
    },
    {
      "key": "signUpPageHeading",
      "role": "heading",
      "accessibleName": "Sign up Page",
      "locator": "getByRole('heading', { name: 'Sign up Page' })",
      "count": 1,
      "requiresScoping": false,
      "visible": true,
      "enabled": true,
      "firstSeenBuild": "local-dev"
    },
    {
      "key": "siteStructureHeading",
      "role": "heading",
      "accessibleName": "Site Structure",
      "locator": "getByRole('heading', { name: 'Site Structure' })",
      "count": 1,
      "requiresScoping": false,
      "visible": true,
      "enabled": true,
      "firstSeenBuild": "local-dev"
    },
    {
      "key": "termsOfUseHeading",
      "role": "heading",
      "accessibleName": "Terms of Use",
      "locator": "getByRole('heading', { name: 'Terms of Use' })",
      "count": 1,
      "requiresScoping": false,
      "visible": true,
      "enabled": true,
      "firstSeenBuild": "local-dev"
    },
    {
      "key": "heading",
      "role": "heading",
      "accessibleName": "This site is a sandbox to practice test automation.",
      "locator": "getByRole('heading', { name: 'This site is a sandbox to practice test automation.' })",
      "count": 1,
      "requiresScoping": false,
      "visible": true,
      "enabled": true,
      "firstSeenBuild": "local-dev"
    },
    {
      "key": "githubLink",
      "role": "link",
      "accessibleName": "GitHub",
      "locator": "getByRole('link', { name: 'GitHub' })",
      "count": 1,
      "requiresScoping": false,
      "visible": true,
      "enabled": true,
      "firstSeenBuild": "local-dev"
    },
    {
      "key": "homeLink",
      "role": "link",
      "accessibleName": "Home",
      "locator": "getByRole('link', { name: 'Home' })",
      "count": 1,
      "requiresScoping": false,
      "visible": true,
      "enabled": true,
      "firstSeenBuild": "local-dev"
    },
    {
      "key": "hotelPlanisphereLink",
      "role": "link",
      "accessibleName": "Hotel Planisphere",
      "locator": "getByRole('link', { name: 'Hotel Planisphere' })",
      "count": 1,
      "requiresScoping": false,
      "visible": false,
      "enabled": true,
      "firstSeenBuild": "local-dev"
    },
    {
      "key": "httpshotelExampleSitetakeyaqadevLink",
      "role": "link",
      "accessibleName": "https://hotel-example-site.takeyaqa.dev/",
      "locator": "getByRole('link', { name: 'https://hotel-example-site.takeyaqa.dev/' })",
      "count": 1,
      "requiresScoping": false,
      "visible": true,
      "enabled": true,
      "firstSeenBuild": "local-dev"
    },
    {
      "key": "mitLicenseLink",
      "role": "link",
      "accessibleName": "MIT License",
      "locator": "getByRole('link', { name: 'MIT License' })",
      "count": 1,
      "requiresScoping": false,
      "visible": true,
      "enabled": true,
      "firstSeenBuild": "local-dev"
    },
    {
      "key": "mypageLink",
      "role": "link",
      "accessibleName": "Mypage",
      "locator": "getByRole('link', { name: 'Mypage' })",
      "count": 1,
      "requiresScoping": false,
      "visible": false,
      "enabled": true,
      "firstSeenBuild": "local-dev"
    },
    {
      "key": "reserveLink",
      "role": "link",
      "accessibleName": "Reserve",
      "locator": "getByRole('link', { name: 'Reserve' })",
      "count": 1,
      "requiresScoping": false,
      "visible": true,
      "enabled": true,
      "firstSeenBuild": "local-dev"
    },
    {
      "key": "signUpLink",
      "role": "link",
      "accessibleName": "Sign up",
      "locator": "getByRole('link', { name: 'Sign up' })",
      "count": 1,
      "requiresScoping": false,
      "visible": true,
      "enabled": true,
      "firstSeenBuild": "local-dev"
    }
  ],
  "ariaDigest": "sha256:8d13a57de73bd745d956a0ae47c446c7eb515db1db51a6dd9dec82b98d41b845",
  "notes": []
}
