{
  "$schema": "./schema.json",
  "route": "/my-account/",
  "pageKey": "TAMyAccount",
  "capturedAt": "2026-09-01T07:22:58.918Z",
  "appBuild": "local-dev",
  "harvesterVersion": "1.0.0",
  "auth": {
    "roleKey": "standardUser",
    "stateGeneratedAt": "2026-09-01T07:14:20.076Z"
  },
  "state": {
    "variantKey": "default"
  },
  "elements": [
    {
      "key": "accountDetailsLink",
      "role": "link",
      "accessibleName": "Account details",
      "locator": "getByRole('link', { name: 'Account details', exact: true })",
      "count": 1,
      "requiresScoping": false,
      "visible": true,
      "enabled": true,
      "firstSeenBuild": "local-dev"
    },
    {
      "key": "addressesLink",
      "role": "link",
      "accessibleName": "Addresses",
      "locator": "getByRole('link', { name: 'Addresses', exact: true })",
      "count": 1,
      "requiresScoping": false,
      "visible": true,
      "enabled": true,
      "firstSeenBuild": "local-dev"
    },
    {
      "key": "dashboardLink",
      "role": "link",
      "accessibleName": "Dashboard",
      "locator": "getByRole('link', { name: 'Dashboard', exact: true })",
      "count": 1,
      "requiresScoping": false,
      "visible": true,
      "enabled": true,
      "firstSeenBuild": "local-dev"
    },
    {
      "key": "downloadsLink",
      "role": "link",
      "accessibleName": "Downloads",
      "locator": "getByRole('link', { name: 'Downloads', exact: true })",
      "count": 1,
      "requiresScoping": false,
      "visible": true,
      "enabled": true,
      "firstSeenBuild": "local-dev"
    },
    {
      "key": "logoutLink",
      "role": "link",
      "accessibleName": "Logout",
      "locator": "getByRole('link', { name: 'Logout', exact: true })",
      "count": 1,
      "requiresScoping": false,
      "visible": true,
      "enabled": true,
      "firstSeenBuild": "local-dev"
    },
    {
      "key": "ordersLink",
      "role": "link",
      "accessibleName": "Orders",
      "locator": "getByRole('link', { name: 'Orders', exact: true })",
      "count": 1,
      "requiresScoping": false,
      "visible": true,
      "enabled": true,
      "firstSeenBuild": "local-dev"
    },
    {
      "key": "subscriptionsLink",
      "role": "link",
      "accessibleName": "Subscriptions",
      "locator": "getByRole('link', { name: 'Subscriptions', exact: true })",
      "count": 1,
      "requiresScoping": false,
      "visible": true,
      "enabled": true,
      "firstSeenBuild": "local-dev"
    },
    {
      "key": "basicLocalAvatarTextbox",
      "role": "textbox",
      "locator": "locator('#basic-local-avatar')",
      "count": 2,
      "requiresScoping": true,
      "visible": true,
      "enabled": true,
      "firstSeenBuild": "local-dev"
    },
    {
      "key": "basicUserAvatarNonceTextbox",
      "role": "textbox",
      "locator": "locator('#_basic_user_avatar_nonce')",
      "count": 2,
      "requiresScoping": true,
      "visible": false,
      "enabled": true,
      "firstSeenBuild": "local-dev"
    }
  ],
  "ariaDigest": "sha256:2b2945cb7e9e2082ae202b9dcf3034b9f47c3bfe4585c2ad60c02269d8ef055c",
  "notes": []
}
