{
  "$schema": "./schema.json",
  "route": "/en-US/signup.html",
  "pageKey": "HotelSignup",
  "capturedAt": "2026-09-01T07:22:45.779Z",
  "appBuild": "local-dev",
  "harvesterVersion": "1.0.0",
  "auth": {
    "roleKey": "unauthenticated"
  },
  "state": {
    "variantKey": "default"
  },
  "elements": [
    {
      "key": "loginButton",
      "role": "button",
      "accessibleName": "Login",
      "locator": "getByRole('button', { name: 'Login', exact: true })",
      "count": 1,
      "requiresScoping": false,
      "visible": true,
      "enabled": true,
      "firstSeenBuild": "local-dev"
    },
    {
      "key": "signUpButton",
      "role": "button",
      "accessibleName": "Sign up",
      "locator": "getByRole('button', { name: 'Sign up', exact: true })",
      "count": 1,
      "requiresScoping": false,
      "visible": true,
      "enabled": true,
      "firstSeenBuild": "local-dev"
    },
    {
      "key": "toggleNavigationButton",
      "role": "button",
      "accessibleName": "Toggle navigation",
      "locator": "getByRole('button', { name: 'Toggle navigation', exact: true })",
      "count": 1,
      "requiresScoping": false,
      "visible": false,
      "enabled": true,
      "firstSeenBuild": "local-dev"
    },
    {
      "key": "receiveNotificationCheckbox",
      "role": "checkbox",
      "accessibleName": "Receive notification",
      "locator": "getByLabel('Receive notification')",
      "fallbackLocators": ["getByRole('checkbox', { name: 'Receive notification', exact: true })"],
      "count": 1,
      "requiresScoping": false,
      "visible": true,
      "enabled": true,
      "firstSeenBuild": "local-dev"
    },
    {
      "key": "genderCombobox",
      "role": "combobox",
      "accessibleName": "Gender",
      "locator": "getByLabel('Gender')",
      "fallbackLocators": ["getByRole('combobox', { name: 'Gender', exact: true })"],
      "count": 1,
      "requiresScoping": false,
      "visible": true,
      "enabled": true,
      "firstSeenBuild": "local-dev"
    },
    {
      "key": "hotelPlanisphereHeading",
      "role": "heading",
      "accessibleName": "Hotel Planisphere",
      "locator": "getByRole('heading', { name: 'Hotel Planisphere', exact: true })",
      "count": 1,
      "requiresScoping": false,
      "visible": true,
      "enabled": true,
      "firstSeenBuild": "local-dev"
    },
    {
      "key": "signUpHeading",
      "role": "heading",
      "accessibleName": "Sign up",
      "locator": "getByRole('heading', { name: 'Sign up', exact: true })",
      "count": 1,
      "requiresScoping": false,
      "visible": true,
      "enabled": true,
      "firstSeenBuild": "local-dev"
    },
    {
      "key": "githubLink",
      "role": "link",
      "accessibleName": "GitHub",
      "locator": "getByRole('link', { name: 'GitHub', exact: true })",
      "count": 1,
      "requiresScoping": false,
      "visible": true,
      "enabled": true,
      "firstSeenBuild": "local-dev"
    },
    {
      "key": "homeLink",
      "role": "link",
      "accessibleName": "Home",
      "locator": "getByRole('link', { name: 'Home', exact: true })",
      "count": 1,
      "requiresScoping": false,
      "visible": true,
      "enabled": true,
      "firstSeenBuild": "local-dev"
    },
    {
      "key": "hotelPlanisphereLink",
      "role": "link",
      "accessibleName": "Hotel Planisphere",
      "locator": "getByRole('link', { name: 'Hotel Planisphere', exact: true })",
      "count": 1,
      "requiresScoping": false,
      "visible": false,
      "enabled": true,
      "firstSeenBuild": "local-dev"
    },
    {
      "key": "reserveLink",
      "role": "link",
      "accessibleName": "Reserve",
      "locator": "getByRole('link', { name: 'Reserve', exact: true })",
      "count": 1,
      "requiresScoping": false,
      "visible": true,
      "enabled": true,
      "firstSeenBuild": "local-dev"
    },
    {
      "key": "signUpLink",
      "role": "link",
      "accessibleName": "Sign up",
      "locator": "getByRole('link', { name: 'Sign up', exact: true })",
      "count": 1,
      "requiresScoping": false,
      "visible": true,
      "enabled": true,
      "firstSeenBuild": "local-dev"
    },
    {
      "key": "membershipRadio",
      "role": "radio",
      "accessibleName": "Membership",
      "locator": "getByRole('radio', { name: 'Membership', exact: true })",
      "fallbackLocators": ["locator('#rank-normal')"],
      "count": 1,
      "requiresScoping": false,
      "visible": true,
      "enabled": true,
      "firstSeenBuild": "local-dev"
    },
    {
      "key": "premiumMembershipRadio",
      "role": "radio",
      "accessibleName": "PREMIUM Membership",
      "locator": "getByRole('radio', { name: 'PREMIUM Membership', exact: true })",
      "fallbackLocators": ["locator('#rank-premium')"],
      "count": 1,
      "requiresScoping": false,
      "visible": true,
      "enabled": true,
      "firstSeenBuild": "local-dev"
    },
    {
      "key": "addressTextbox",
      "role": "textbox",
      "accessibleName": "Address",
      "locator": "getByLabel('Address')",
      "fallbackLocators": ["getByRole('textbox', { name: 'Address', exact: true })"],
      "count": 1,
      "requiresScoping": false,
      "visible": true,
      "enabled": true,
      "firstSeenBuild": "local-dev"
    },
    {
      "key": "dateOfBirthTextbox",
      "role": "textbox",
      "accessibleName": "Date of birth",
      "locator": "getByLabel('Date of birth')",
      "fallbackLocators": ["getByRole('textbox', { name: 'Date of birth', exact: true })"],
      "count": 1,
      "requiresScoping": false,
      "visible": true,
      "enabled": true,
      "firstSeenBuild": "local-dev"
    },
    {
      "key": "emailRequiredTextbox",
      "role": "textbox",
      "accessibleName": "Email required",
      "locator": "getByLabel('Email required')",
      "fallbackLocators": ["getByRole('textbox', { name: 'Email required', exact: true })"],
      "count": 1,
      "requiresScoping": false,
      "visible": true,
      "enabled": true,
      "firstSeenBuild": "local-dev"
    },
    {
      "key": "nameRequiredTextbox",
      "role": "textbox",
      "accessibleName": "Name required",
      "locator": "getByLabel('Name required')",
      "fallbackLocators": ["getByRole('textbox', { name: 'Name required', exact: true })"],
      "count": 1,
      "requiresScoping": false,
      "visible": true,
      "enabled": true,
      "firstSeenBuild": "local-dev"
    },
    {
      "key": "passwordConfirmationRequiredTextbox",
      "role": "textbox",
      "accessibleName": "Password (confirmation) required",
      "locator": "getByLabel('Password (confirmation) required')",
      "fallbackLocators": ["getByRole('textbox', { name: 'Password (confirmation) required', exact: true })"],
      "count": 1,
      "requiresScoping": false,
      "visible": true,
      "enabled": true,
      "firstSeenBuild": "local-dev"
    },
    {
      "key": "passwordRequiredTextbox",
      "role": "textbox",
      "accessibleName": "Password required",
      "locator": "getByLabel('Password required')",
      "fallbackLocators": ["getByRole('textbox', { name: 'Password required', exact: true })"],
      "count": 1,
      "requiresScoping": false,
      "visible": true,
      "enabled": true,
      "firstSeenBuild": "local-dev"
    },
    {
      "key": "telTextbox",
      "role": "textbox",
      "accessibleName": "Tel",
      "locator": "getByLabel('Tel')",
      "fallbackLocators": ["getByRole('textbox', { name: 'Tel', exact: true })"],
      "count": 1,
      "requiresScoping": false,
      "visible": true,
      "enabled": true,
      "firstSeenBuild": "local-dev"
    }
  ],
  "ariaDigest": "sha256:6f8f6d190b7482ca5297a477d16563a04854ebfc1e1ed1bd38ae4765f7e40628",
  "notes": []
}
