{
  "$schema": "./schema.json",
  "route": "/en-US/mypage.html",
  "pageKey": "HotelMyPage",
  "capturedAt": "2026-08-19T09:44:07.870Z",
  "appBuild": "local-dev",
  "harvesterVersion": "1.0.0",
  "auth": {
    "roleKey": "hotelUser",
    "stateGeneratedAt": "2026-08-18T10:19:35.778Z"
  },
  "state": {
    "variantKey": "default"
  },
  "elements": [
    {
      "key": "deleteAccountButton",
      "role": "button",
      "accessibleName": "Delete Account",
      "locator": "getByRole('button', { name: 'Delete Account', exact: true })",
      "count": 1,
      "requiresScoping": false,
      "visible": true,
      "enabled": false,
      "firstSeenBuild": "local-dev"
    },
    {
      "key": "iconSettingButton",
      "role": "button",
      "accessibleName": "Icon Setting",
      "locator": "getByRole('button', { name: 'Icon Setting', exact: true })",
      "fallbackLocators": ["locator('#icon-link')"],
      "count": 1,
      "requiresScoping": false,
      "visible": true,
      "enabled": true,
      "firstSeenBuild": "local-dev"
    },
    {
      "key": "logoutButton",
      "role": "button",
      "accessibleName": "Logout",
      "locator": "getByRole('button', { name: 'Logout', exact: true })",
      "count": 1,
      "requiresScoping": false,
      "visible": true,
      "enabled": true,
      "firstSeenBuild": "local-dev"
    },
    {
      "key": "toggleNavigationButton",
      "role": "button",
      "accessibleName": "Toggle navigation",
      "locator": "getByRole('button', { name: 'Toggle navigation', exact: true })",
      "count": 1,
      "requiresScoping": false,
      "visible": false,
      "enabled": true,
      "firstSeenBuild": "local-dev"
    },
    {
      "key": "addressHeading",
      "role": "heading",
      "accessibleName": "Address",
      "locator": "getByRole('heading', { name: 'Address', exact: true })",
      "count": 1,
      "requiresScoping": false,
      "visible": true,
      "enabled": true,
      "firstSeenBuild": "local-dev"
    },
    {
      "key": "dateOfBirthHeading",
      "role": "heading",
      "accessibleName": "Date of birth",
      "locator": "getByRole('heading', { name: 'Date of birth', exact: true })",
      "count": 1,
      "requiresScoping": false,
      "visible": true,
      "enabled": true,
      "firstSeenBuild": "local-dev"
    },
    {
      "key": "emailHeading",
      "role": "heading",
      "accessibleName": "Email",
      "locator": "getByRole('heading', { name: 'Email', exact: true })",
      "count": 1,
      "requiresScoping": false,
      "visible": true,
      "enabled": true,
      "firstSeenBuild": "local-dev"
    },
    {
      "key": "genderHeading",
      "role": "heading",
      "accessibleName": "Gender",
      "locator": "getByRole('heading', { name: 'Gender', exact: true })",
      "count": 1,
      "requiresScoping": false,
      "visible": true,
      "enabled": true,
      "firstSeenBuild": "local-dev"
    },
    {
      "key": "hotelPlanisphereHeading",
      "role": "heading",
      "accessibleName": "Hotel Planisphere",
      "locator": "getByRole('heading', { name: 'Hotel Planisphere', exact: true })",
      "count": 1,
      "requiresScoping": false,
      "visible": true,
      "enabled": true,
      "firstSeenBuild": "local-dev"
    },
    {
      "key": "membershipHeading",
      "role": "heading",
      "accessibleName": "Membership",
      "locator": "getByRole('heading', { name: 'Membership', exact: true })",
      "count": 1,
      "requiresScoping": false,
      "visible": true,
      "enabled": true,
      "firstSeenBuild": "local-dev"
    },
    {
      "key": "mypageHeading",
      "role": "heading",
      "accessibleName": "MyPage",
      "locator": "getByRole('heading', { name: 'MyPage', exact: true })",
      "count": 1,
      "requiresScoping": false,
      "visible": true,
      "enabled": true,
      "firstSeenBuild": "local-dev"
    },
    {
      "key": "nameHeading",
      "role": "heading",
      "accessibleName": "Name",
      "locator": "getByRole('heading', { name: 'Name', exact: true })",
      "count": 1,
      "requiresScoping": false,
      "visible": true,
      "enabled": true,
      "firstSeenBuild": "local-dev"
    },
    {
      "key": "notificationHeading",
      "role": "heading",
      "accessibleName": "Notification",
      "locator": "getByRole('heading', { name: 'Notification', exact: true })",
      "count": 1,
      "requiresScoping": false,
      "visible": true,
      "enabled": true,
      "firstSeenBuild": "local-dev"
    },
    {
      "key": "telHeading",
      "role": "heading",
      "accessibleName": "Tel",
      "locator": "getByRole('heading', { name: 'Tel', exact: true })",
      "count": 1,
      "requiresScoping": false,
      "visible": true,
      "enabled": true,
      "firstSeenBuild": "local-dev"
    },
    {
      "key": "githubLink",
      "role": "link",
      "accessibleName": "GitHub",
      "locator": "getByRole('link', { name: 'GitHub', exact: true })",
      "count": 1,
      "requiresScoping": false,
      "visible": true,
      "enabled": true,
      "firstSeenBuild": "local-dev"
    },
    {
      "key": "homeLink",
      "role": "link",
      "accessibleName": "Home",
      "locator": "getByRole('link', { name: 'Home', exact: true })",
      "count": 1,
      "requiresScoping": false,
      "visible": true,
      "enabled": true,
      "firstSeenBuild": "local-dev"
    },
    {
      "key": "hotelPlanisphereLink",
      "role": "link",
      "accessibleName": "Hotel Planisphere",
      "locator": "getByRole('link', { name: 'Hotel Planisphere', exact: true })",
      "count": 1,
      "requiresScoping": false,
      "visible": false,
      "enabled": true,
      "firstSeenBuild": "local-dev"
    },
    {
      "key": "mypageLink",
      "role": "link",
      "accessibleName": "Mypage",
      "locator": "getByRole('link', { name: 'Mypage', exact: true })",
      "count": 1,
      "requiresScoping": false,
      "visible": true,
      "enabled": true,
      "firstSeenBuild": "local-dev"
    },
    {
      "key": "reserveLink",
      "role": "link",
      "accessibleName": "Reserve",
      "locator": "getByRole('link', { name: 'Reserve', exact: true })",
      "count": 1,
      "requiresScoping": false,
      "visible": true,
      "enabled": true,
      "firstSeenBuild": "local-dev"
    }
  ],
  "ariaDigest": "sha256:ba49813744d6a88da7edd0f48281311588b8608f777a9efa86e8dda9e18bd37f",
  "notes": []
}
