{
  "$schema": "./schema.json",
  "route": "/account_created",
  "pageKey": "AEAccountCreated",
  "capturedAt": "2026-08-19T09:45:39.739Z",
  "appBuild": "local-dev",
  "harvesterVersion": "1.0.0",
  "auth": {
    "roleKey": "unauthenticated"
  },
  "state": {
    "variantKey": "default"
  },
  "elements": [
    {
      "key": "subscribeButton",
      "role": "button",
      "locator": "locator('#subscribe')",
      "count": 1,
      "requiresScoping": false,
      "visible": true,
      "enabled": true,
      "firstSeenBuild": "local-dev"
    },
    {
      "key": "accountCreatedHeading",
      "role": "heading",
      "accessibleName": "Account Created!",
      "locator": "getByRole('heading', { name: 'Account Created!', exact: true })",
      "count": 1,
      "requiresScoping": false,
      "visible": true,
      "enabled": true,
      "firstSeenBuild": "local-dev"
    },
    {
      "key": "subscriptionHeading",
      "role": "heading",
      "accessibleName": "Subscription",
      "locator": "getByRole('heading', { name: 'Subscription', exact: true })",
      "count": 1,
      "requiresScoping": false,
      "visible": true,
      "enabled": true,
      "firstSeenBuild": "local-dev"
    },
    {
      "key": "scrollupLink",
      "role": "link",
      "locator": "locator('#scrollUp')",
      "count": 2,
      "requiresScoping": true,
      "visible": false,
      "enabled": true,
      "firstSeenBuild": "local-dev"
    },
    {
      "key": "apiTestingLink",
      "role": "link",
      "accessibleName": "API Testing",
      "locator": "getByRole('link', { name: 'API Testing', exact: true })",
      "count": 1,
      "requiresScoping": false,
      "visible": true,
      "enabled": true,
      "firstSeenBuild": "local-dev"
    },
    {
      "key": "cartLink",
      "role": "link",
      "accessibleName": "Cart",
      "locator": "getByRole('link', { name: 'Cart', exact: true })",
      "count": 1,
      "requiresScoping": false,
      "visible": true,
      "enabled": true,
      "firstSeenBuild": "local-dev"
    },
    {
      "key": "contactUsLink",
      "role": "link",
      "accessibleName": "Contact us",
      "locator": "getByRole('link', { name: 'Contact us', exact: true })",
      "count": 1,
      "requiresScoping": false,
      "visible": true,
      "enabled": true,
      "firstSeenBuild": "local-dev"
    },
    {
      "key": "continueLink",
      "role": "link",
      "accessibleName": "Continue",
      "locator": "getByRole('link', { name: 'Continue', exact: true })",
      "count": 1,
      "requiresScoping": false,
      "visible": true,
      "enabled": true,
      "firstSeenBuild": "local-dev"
    },
    {
      "key": "homeLink",
      "role": "link",
      "accessibleName": "Home",
      "locator": "getByRole('link', { name: 'Home', exact: true })",
      "count": 1,
      "requiresScoping": false,
      "visible": true,
      "enabled": true,
      "firstSeenBuild": "local-dev"
    },
    {
      "key": "signupLoginLink",
      "role": "link",
      "accessibleName": "Signup / Login",
      "locator": "getByRole('link', { name: 'Signup / Login', exact: true })",
      "count": 1,
      "requiresScoping": false,
      "visible": true,
      "enabled": true,
      "firstSeenBuild": "local-dev"
    },
    {
      "key": "testCasesLink",
      "role": "link",
      "accessibleName": "Test Cases",
      "locator": "getByRole('link', { name: 'Test Cases', exact: true })",
      "count": 1,
      "requiresScoping": false,
      "visible": true,
      "enabled": true,
      "firstSeenBuild": "local-dev"
    },
    {
      "key": "videoTutorialsLink",
      "role": "link",
      "accessibleName": "Video Tutorials",
      "locator": "getByRole('link', { name: 'Video Tutorials', exact: true })",
      "count": 1,
      "requiresScoping": false,
      "visible": true,
      "enabled": true,
      "firstSeenBuild": "local-dev"
    },
    {
      "key": "productsLink",
      "role": "link",
      "accessibleName": " Products",
      "locator": "getByRole('link', { name: ' Products', exact: true })",
      "count": 1,
      "requiresScoping": false,
      "visible": true,
      "enabled": true,
      "firstSeenBuild": "local-dev"
    },
    {
      "key": "yourEmailAddressTextbox",
      "role": "textbox",
      "accessibleName": "Your email address",
      "locator": "getByRole('textbox', { name: 'Your email address', exact: true })",
      "fallbackLocators": ["locator('#susbscribe_email')"],
      "count": 1,
      "requiresScoping": false,
      "visible": true,
      "enabled": true,
      "firstSeenBuild": "local-dev"
    }
  ],
  "ariaDigest": "sha256:6877df475a01246df00bbab3e865f7eaa362bb31a766a9b04264cf2928e8cdc2",
  "notes": []
}
